{"$id":"urn:mcpaudit:evidence-conservation:BoundaryDecisionV1","$schema":"https://json-schema.org/draft/2020-12/schema","additionalProperties":false,"properties":{"admission_status":{"enum":["CANDIDATE","ADMITTED","REJECTED"]},"body":{"additionalProperties":false,"properties":{"approval_evidence":{"additionalProperties":false,"properties":{"message_sha256":{"pattern":"^[0-9a-f]{64}$","type":"string"},"thread_id":{"minLength":1,"type":"string"},"turn_id":{"minLength":1,"type":"string"}},"required":["thread_id","turn_id","message_sha256"],"type":"object"},"contradictions":{"items":{"type":"object"},"maxItems":0,"type":"array"},"p2_decision_surface":{"const":"PER_SERVER_FIXTURE_GRADE_ADMISSIBILITY"},"p2_exclusions":{"items":{"minLength":1,"type":"string"},"maxItems":4,"minItems":4,"type":"array"},"pcc_binding_owner":{"const":"PORTFOLIO_COMMAND_CENTER"},"strict_downgrade":{"const":"REQUIRED"}},"required":["strict_downgrade","pcc_binding_owner","p2_decision_surface","p2_exclusions","approval_evidence","contradictions"],"type":"object"},"content_sha256":{"pattern":"^[0-9a-f]{64}$","type":"string"},"created_at_utc":{"minLength":1,"type":"string"},"producer":{"additionalProperties":false,"properties":{"actor_id":{"minLength":1,"type":"string"},"role":{"minLength":1,"type":"string"}},"required":["actor_id","role"],"type":"object"},"record_id":{"minLength":1,"type":"string"},"reviews":{"items":{"additionalProperties":false,"properties":{"decision":{"enum":["ADMIT","REJECT"]},"independent_from":{"items":{"minLength":1,"type":"string"},"type":"array"},"rationale":{"minLength":1,"type":"string"},"reviewed_at_utc":{"minLength":1,"type":"string"},"reviewed_content_sha256":{"pattern":"^[0-9a-f]{64}$","type":"string"},"reviewer_id":{"minLength":1,"type":"string"}},"required":["reviewer_id","independent_from","decision","reviewed_at_utc","reviewed_content_sha256","rationale"],"type":"object"},"type":"array"},"schema":{"const":"BoundaryDecisionV1"},"spec_sha256":{"pattern":"^[0-9a-f]{64}$","type":"string"},"supersedes":{"type":["string","null"]}},"required":["schema","record_id","spec_sha256","created_at_utc","producer","supersedes","body","content_sha256","reviews","admission_status"],"type":"object"}
