{"admission_status":"CANDIDATE","body":{"approval_evidence":{"message_sha256":"7a54d1adbc69cb4f938954ea48d0c853df5da48267ef2d4d970fbce951d35548","thread_id":"019fb6d5-1875-7551-ad41-f8e5258107e4","turn_id":"019fb6d5-1b1b-7f22-be1b-513456df2635"},"contradictions":[],"p2_decision_surface":"PER_SERVER_FIXTURE_GRADE_ADMISSIBILITY","p2_exclusions":["GLOBAL_PUBLICATION_READY","REFRESH_PUBLICATION","LIVE_SCAN","SCHEDULER_READINESS"],"pcc_binding_owner":"PORTFOLIO_COMMAND_CENTER","strict_downgrade":"REQUIRED"},"content_sha256":"5124fd11550da4beaad5d3b206c2fe8a3720c5c836bbbbe5358e77efa99f3cf2","created_at_utc":"2026-07-31T16:20:00Z","producer":{"actor_id":"codex","role":"EVIDENCE_PACKAGE_GENERATOR"},"record_id":"boundary-decision-v1","reviews":[],"schema":"BoundaryDecisionV1","spec_sha256":"711b5c32b053a0e471b9d7e8b0327160d205a8bdfa88f207a921909905afd188","supersedes":null}
